candidate_rank,vendor,part_number,lifecycle_status,input_type,tia_candidate_role,voltage_noise_nV_per_sqrtHz,voltage_noise_condition,current_noise_fA_per_sqrtHz,current_noise_condition,ft_proxy_MHz,ft_proxy_metric,bandwidth_at_acl_MHz,bandwidth_condition,min_stable_gain_V_per_V,input_capacitance_common_mode_pF,input_capacitance_differential_pF,input_capacitance_total_pF,input_capacitance_note,supply_min_V,supply_max_V,package_notes,spice_model_status,candidate_notes,primary_source_url,source_document,source_accessed_date
1,Texas Instruments,OPA818,ACTIVE,FET input voltage feedback,Primary wideband FET-input TIA candidate,2.2,f >= 150 kHz / flatband,3,f = 10 kHz,2700,GBWP; decompensated gain >= 7 V/V,765,G = 7 V/V,7,1.9,0.5,2.4,Common-mode plus differential input capacitance from datasheet feature list,6,13,"5-pin SOT-23; 8-lead WSON with exposed thermal pad","TI TINA-TI and PSpice models listed on product page","Upgrade path from OPA657; strong fit for moderate-to-high transimpedance gains but decompensated architecture must be respected",https://www.ti.com/product/OPA818,"OPA818 datasheet Rev. B / TI product page",2026-06-16
2,Analog Devices,LTC6268-10,RECOMMENDED FOR NEW DESIGNS,FET input voltage feedback,Ultra-low input capacitance high-speed TIA candidate,4.0,f = 1 MHz,7,f = 100 kHz,4000,GBWP; gain-of-10 stable,,not listed as a scalar ACL bandwidth on product summary,10,,,0.45,"Product page reports total C_IN rather than split common-mode/differential values",3.1,5.25,"Single 8-lead SOIC and 6-lead TSOT-23; dual LTC6269-10 variants also available","ADI product page lists LTspice model availability","Very low C_IN and fA current noise make this a strong high-impedance photodiode candidate; gain-of-10 stability matters for loop design",https://www.analog.com/en/products/ltc6268-10.html,"LTC6268-10/LTC6269-10 datasheet / ADI product page",2026-06-16
3,Texas Instruments,OPA858,ACTIVE,FET / CMOS input voltage feedback,Very high-GBW optical-front-end TIA candidate,2.5,f = 1 MHz,NaN,"No scalar input-current-noise value tabulated in reviewed summary; datasheet provides current-noise plot",5500,GBWP; decompensated gain >= 7 V/V,1200,small-signal bandwidth at G = 7 V/V,7,0.62,0.2,0.82,Electrical table gives 0.62 pF common-mode and 0.2 pF differential capacitance,3.3,5.25,"8-pin WSON; bare die option; feedback pin","TI PSpice and TINA-TI models listed on product page","Designed for wideband TIA and time-of-flight optical front ends; current-noise scalar should be confirmed from graph or vendor model before ranking for high-Rf noise",https://www.ti.com/product/OPA858,"OPA858 datasheet Rev. B / TI product page",2026-06-16
4,Analog Devices,ADA4817-1,PRODUCTION,FET input voltage feedback,Unity-gain stable 1-GHz FastFET photodiode candidate,4.0,f = 100 kHz,2.5,f = 100 kHz,1050,"-3 dB bandwidth at G = 1; used as ft proxy for unity-gain-stable part",1050,"G = 1, RL = 100 ohm",1,1.3,0.1,1.4,Common-mode plus differential values from ADI product page,5,10,"3 mm x 3 mm 8-lead LFCSP with exposed pad; 8-lead SOIC","ADI product page lists ADA4817 SPICE macro model","Unity-gain stable FET-input option with explicit photodiode preamp positioning; lower GBW than decompensated GHz-class candidates but easier low-gain use",https://www.analog.com/en/products/ada4817-1.html,"ADA4817-1/ADA4817-2 datasheet Rev. I / ADI product page",2026-06-16
5,Texas Instruments,OPA657,ACTIVE,FET input voltage feedback,Existing-generation high-speed FET TIA candidate,4.8,f > 100 kHz,1.3,f > 100 kHz,1600,GBWP; decompensated gain >= 7 V/V,275,G = 10 V/V,7,4.5,0.7,5.2,Electrical table gives common-mode 4.5 pF and differential 0.7 pF,8,12,"8-pin SOIC; 5-pin SOT-23","TI product page lists simulation resources; OPA818 noted as newer upgrade","Useful historical and still-active FET TIA part; higher input capacitance and voltage noise than OPA818",https://www.ti.com/product/OPA657,"OPA657 datasheet Rev. F / TI product page",2026-06-16
6,Texas Instruments,LMH6629,ACTIVE,Bipolar input voltage feedback,Ultra-low voltage-noise candidate for low source impedance / lower Rf cases,0.69,f > 1 MHz,2600,f > 1 MHz,4000,GBWP from TI product page,900,"-3 dB bandwidth; WSON-8 package conditions",4,1.7,4.0,5.7,Electrical table gives 1.7 pF common-mode and 4 pF differential capacitance,2.7,5.5,"5-pin SOT-23; 8-pin WSON; selectable minimum gain >= 4 or >= 10 V/V","TI product page lists datasheet and design resources; SPICE model availability should be checked before Round 8 use","Excellent voltage noise but pA current noise and high input capacitance make it less attractive for high-Rf photodiode TIAs",https://www.ti.com/product/LMH6629,"LMH6629 datasheet Rev. I / TI product page",2026-06-16
7,Texas Instruments,OPA847,ACTIVE,Bipolar input voltage feedback,Ultra-low voltage-noise decompensated comparison candidate,0.85,f > 1 MHz,2500,f > 1 MHz,3900,GBWP; decompensated gain >= 12 V/V,600,G = 12 V/V,12,1.7,2.0,3.7,"Electrical input-impedance row gives 1.7 pF common-mode and 2.0 pF differential; application example should be rechecked before final design",10,12,"8-pin SOIC; 6-pin SOT-23","TI product page lists design resources; SPICE model availability should be checked before Round 8 use","Strong low-voltage-noise wideband part, but bipolar current noise and gain >= 12 stability limit high-impedance TIA suitability",https://www.ti.com/product/OPA847,"OPA847 datasheet Rev. E / TI product page",2026-06-16
8,Analog Devices,OP27,NOT RECOMMENDED FOR NEW DESIGNS,Bipolar precision op amp,Existing OP27 smoke-test reference and slow precision comparison point,3.0,f = 1 kHz,400,f = 1 kHz,8,GBWP; unity-gain stable precision op amp,,not listed as wideband ACL value in product summary,1,,,NaN,Input capacitance not captured in reviewed product summary; do not infer for TIA capacitance budgeting,8,36,"8-lead TO-99; CERDIP; PDIP; SOIC; die form","ADI product page lists OP27 LTspice and multiple OP27 SPICE macro models","Included to connect the datasheet table to the existing OP27 smoke-test evidence; not a preferred new high-speed photodiode TIA part",https://www.analog.com/en/products/op27.html,"OP27 datasheet Rev. H / ADI product page",2026-06-16
